{
  "document": "chapters/00-document.json",
  "overview": "chapters/01-overview.json",
  "quick_start": "chapters/02-quick-start.json",
  "architecture_overview": "chapters/03-architecture-overview.json",
  "main_flow_overview": "chapters/04-main-flow-overview.json",
  "main_flow_details": [
    "chapters/04-main-flow-details/init-flow.json"
  ],
  "module_overview": "chapters/05-module-overview.json",
  "module_details": [
    "chapters/05-module-details/storage.json"
  ]
}
